{
  "schemaVersion": 1,
  "version": "1.16.0",
  "description": "Modeling guides for common ExtendSim simulation scenarios. Each guide describes when to use the pattern, which blocks and connections to use, key parameters, and common mistakes.",
  "categories": {
    "queuing": { "label": "Queuing Systems", "scenarios": ["simple_queue", "multi_server", "priority_queue"] },
    "manufacturing": { "label": "Manufacturing", "scenarios": ["serial_line", "inspection_rework", "batch_assembly"] },
    "logistics": { "label": "Logistics & Supply Chain", "scenarios": ["supply_chain", "inventory_management"] },
    "resources": { "label": "Resource Management", "scenarios": ["shared_resources", "shift_schedule"] },
    "flow": { "label": "Continuous Flow (Rate)", "scenarios": ["tank_system"] },
    "continuous": { "label": "Continuous (Value)", "scenarios": ["feedback_control"] }
  },
  "scenarios": {
    "simple_queue": {
      "name": "Simple Queue (M/M/1)",
      "category": "queuing",
      "description": "A single-server queuing system where items arrive randomly, wait in a queue, are processed by one server, and depart. This is the foundational discrete-event pattern for any service or processing system.",
      "useWhen": [
        "Modeling a single-server service point (cashier, machine, call agent)",
        "Analyzing waiting times and queue lengths under variable demand",
        "Estimating server utilization and throughput capacity",
        "Baseline model before adding complexity like multiple servers or priorities",
        "Teaching or demonstrating Little's Law and queuing theory concepts"
      ],
      "pattern": {
        "blocks": [
          { "name": "Create", "library": "Item.lbr", "label": "Arrivals", "purpose": "Generates items (customers, jobs) according to an inter-arrival time distribution" },
          { "name": "Queue", "library": "Item.lbr", "label": "WaitingLine", "purpose": "Buffers items when the server is busy; tracks queue length and wait time statistics" },
          { "name": "Activity", "library": "Item.lbr", "label": "Server", "purpose": "Processes one item at a time with a configurable service time distribution" },
          { "name": "Exit", "library": "Item.lbr", "label": "Departures", "purpose": "Removes items from the model and records throughput and cycle time statistics" }
        ],
        "connections": [
          "Arrivals (ItemOut) → WaitingLine (ItemIn)",
          "WaitingLine (ItemOut) → Server (ItemIn)",
          "Server (ItemOut) → Departures (ItemIn)"
        ],
        "template": "simple_process"
      },
      "keyParameters": [
        { "block": "Create", "parameter": "distribution / arg1", "typical": "Exponential, mean=5 min", "description": "Inter-arrival time distribution. Exponential gives Poisson arrivals (M/M/1 assumption). Mean sets average time between arrivals." },
        { "block": "Activity", "parameter": "distribution / arg1", "typical": "Exponential, mean=4 min", "description": "Service time distribution. Mean must be less than mean inter-arrival time to keep utilization below 100%." },
        { "block": "Queue", "parameter": "rankType", "typical": "FIFO (0)", "description": "Item ranking rule. FIFO (first-in first-out) is standard for M/M/1. Change to attribute-based for priority queues." },
        { "block": "Create", "parameter": "maxArrivals", "typical": "0 (unlimited)", "description": "Maximum number of items to generate. Set to 0 for unlimited (steady-state runs). Limit for finite-population studies." }
      ],
      "keyMetrics": [
        "Average queue length (WaitingLine block statistics)",
        "Average wait time in queue (WaitingLine block statistics)",
        "Server utilization percentage (Server block statistics)",
        "Throughput (items per time unit, from Departures block)",
        "Average total cycle time (from Departures block)"
      ],
      "commonMistakes": [
        "Forgetting to place a Queue before the Activity — without a Queue, items that arrive when the server is busy are destroyed rather than waiting, causing incorrect throughput and lost-item errors",
        "Setting server utilization at or above 100% (mean service time >= mean inter-arrival time) — the queue grows without bound and the model never reaches steady state; always verify utilization = (mean service time / mean inter-arrival time) < 1",
        "Running the simulation for too short a time — M/M/1 systems need a warm-up period before reaching steady state; results collected during transient phase are not representative",
        "Using a constant (fixed) inter-arrival time instead of exponential when modeling Poisson arrivals — constant arrivals prevent realistic queue buildup and underestimate wait times"
      ],
      "variations": [
        { "name": "Finite queue (blocking)", "scenario": null, "change": "Set Queue maximum capacity to limit queue length; items that arrive when queue is full are rejected or redirected" },
        { "name": "Multiple servers", "scenario": "multi_server", "change": "Replace single Activity with Workstation (maxServers > 1) or add parallel Activities with Select Item Out/In routing" },
        { "name": "Priority service", "scenario": "priority_queue", "change": "Add a Set block before Queue to assign priority attributes; change Queue rankType to attribute-based ranking" }
      ],
      "exampleModel": null
    },

    "multi_server": {
      "name": "Multi-Server Queue (M/M/c)",
      "category": "queuing",
      "description": "A queuing system with multiple parallel servers sharing a single waiting line. Items wait in one queue and are routed to the next available server, modeling call centers, bank teller lines, or parallel machines.",
      "useWhen": [
        "Modeling multiple identical servers serving one shared waiting line (e.g., bank tellers, checkout lanes)",
        "Finding the optimal number of servers to balance cost against customer wait time",
        "Comparing single-queue/multi-server versus multi-queue/single-server configurations",
        "Evaluating the impact of adding or removing servers on throughput and utilization",
        "Modeling parallel machines or workstations in a manufacturing cell"
      ],
      "pattern": {
        "blocks": [
          { "name": "Create", "library": "Item.lbr", "label": "Arrivals", "purpose": "Generates arriving items according to inter-arrival distribution" },
          { "name": "Queue", "library": "Item.lbr", "label": "SharedQueue", "purpose": "Single shared waiting line for all servers; items leave when any server becomes free" },
          { "name": "Workstation", "library": "Item.lbr", "label": "Servers", "purpose": "Multi-server processing block with built-in queue and configurable maxServers parameter; simplest approach for M/M/c" },
          { "name": "Exit", "library": "Item.lbr", "label": "Departures", "purpose": "Collects completed items and records throughput statistics" }
        ],
        "connections": [
          "Arrivals (ItemOut) → Servers (ItemIn)",
          "Servers (ItemOut) → Departures (ItemIn)"
        ],
        "template": "parallel_servers"
      },
      "keyParameters": [
        { "block": "Workstation", "parameter": "maxServers", "typical": "2-5", "description": "Number of parallel server channels. This is the 'c' in M/M/c. The Workstation block includes its own internal queue, so no separate Queue block is needed when using Workstation." },
        { "block": "Workstation", "parameter": "distribution / arg1", "typical": "Exponential, mean=8 min", "description": "Service time distribution per server. Each server independently samples from this distribution." },
        { "block": "Create", "parameter": "distribution / arg1", "typical": "Exponential, mean=3 min", "description": "Inter-arrival time. Total offered load = mean service time / (c * mean inter-arrival time) must be < 1." },
        { "block": "Workstation", "parameter": "maxQueueLength", "typical": "0 (unlimited)", "description": "Maximum internal queue capacity. Set to 0 for unlimited. When queue is full, new arrivals are blocked." }
      ],
      "keyMetrics": [
        "Average number waiting in queue (Workstation internal queue statistics)",
        "Average wait time before service begins",
        "Individual server utilization (should be balanced across servers)",
        "Overall throughput versus arrival rate",
        "Probability that all servers are busy (P(delay))"
      ],
      "commonMistakes": [
        "Using a Workstation block (which has an internal queue) and also placing a separate Queue block before it — this creates two queues in series, inflating wait times and misrepresenting system behavior; use Workstation alone or use separate Queue+Activity blocks",
        "Setting maxServers on a Workstation but forgetting that Workstation service time is per item, not shared across servers — each server independently draws from the service distribution",
        "Connecting parallel Activity blocks without Select Item Out/In routing — items will only flow to the first connected Activity; use Select Item Out (shortest queue mode) to distribute load correctly when using separate Activity blocks instead of Workstation",
        "Not verifying offered load (lambda / (c * mu)) is below 1.0 — with multiple servers the stability condition is different from M/M/1 and is easy to miscalculate"
      ],
      "variations": [
        { "name": "Heterogeneous servers", "scenario": null, "change": "Use separate Queue + multiple Activity blocks with different service time distributions; route via Select Item Out in shortest-queue mode" },
        { "name": "Single server baseline", "scenario": "simple_queue", "change": "Set maxServers=1 on Workstation or use a single Activity to establish the M/M/1 baseline for comparison" },